response,title,main_desc,prerequisite,what_u_learn,instructor,inst_desig,inst_bio,total_duration,total_duration_unit,course_start_date,contents,display_price,emi,currency
<200 https://www.udacity.com/course/web-accessibility--ud891>,Web Accessibility,"<p>In this course you’ll get hands-on experience making web applications accessible. You’ll understand when and why users need accessibility. Then you’ll dive into the ""how"": making a page work properly with screen readers, and managing input focus (e.g. the highlight you see when tabbing through a form.) You’ll understand what ""semantics"" and ""semantic markup"" mean for web pages and add ARIA markup to enable navigating the interface with a range of assistive devices. Finally, you’ll learn styling techniques that help users with partial vision navigate your pages easily and reliably.</p>","Students should know HTML, CSS, and JavaScript.,See the , for using Udacity.",Learn how to build high quality websites and dynamic applications to create stunning user experiences for the web.,Alice Boxhall| Rob Dodson| Michael Wales,,,,,,"<?xml version=""1.0""?><mainmodule><module1><heading>Overview</heading><subheading><item1>Learn why accessibility matters, and who it affects.</item1><item2>Learn how to make a page usable for anyone navigating with the keyboard.</item2><item3>Make a page work for people who are unable to use a standard user interface.</item3><item4>Dive deeper into the screen-reader experience to add hyper-fast navigation.</item4><item5>Move beyond the native elements of HTML into building custom controls and interactions.</item5><item6>Learn the third pillar of Accessibility (after Focus and Semantics): Styling.</item6></subheading></module1><module2><heading>Focus</heading><subheading><item1>Get a first look at the web accessibility guidelines (WAI – Web Accessibility Initiative).</item1><item2>An exploration of focusable elements.</item2><item3>Use a screen reader to try out ordinary form elements and add markup to make them work even better.</item3><item4>Learn how to arrange headings and label links so screen reader users can fly through your pages!</item4><item5>Accessible Rich Internet Applications (ARIA).</item5><item6>Highlight the focus, indicate ARIA states, zoomed in or out, and support limited color or contrast vision.</item6></subheading></module2><module3><heading>Semantics Basics</heading><subheading><item1>Understand “POUR” means for accessibility, and locate checklists to help make your own sites accessible.</item1><item2>Learn how to manage focus in forms, in custom components, pop-ups, and off-screen content.</item2><item3>Understand the accessibility tree the browser constructs from the DOM.</item3><item4>Call out “landmarks” into your page to speed up navigation even more.</item4><item5>Learn how to add attributes to your custom interactions to make them as accessible as native elements.</item5><item6>Audit your page with the Chrome Accessibility Tools and correct any styling issues that pop up.</item6></subheading></module3><module4><heading>Semantics Extras</heading><subheading></subheading></module4><module5><heading>Semantics - ARIA</heading><subheading></subheading></module5><module6><heading>Style</heading><subheading></subheading></module6></mainmodule>",Free,,
<200 https://www.udacity.com/course/developing-android-apps-with-kotlin--ud9012>,Developing Android Apps with Kotlin,"<p>Learn to architect and develop Android apps in the Kotlin programming language using industry-proven tools and libraries. With these techniques you'll create apps in less time, writing less code, and with fewer errors.</p>","To succeed in this course, you should have experience navigating GitHub, and be comfortable using a Modern IDE, and the OOP language. You should be familiar with threads and concurrency, and with modular app architectures.,Some Kotlin experience is also recommended. You should be comfortable with Kotlin syntax including: nullable and non-nullable variables, methods with default and variable arguments, data classes, object expressions, lambdas and extensions.,Finally, you’ll need: ,See the , for using Udacity.",Master Android development with Kotlin and build professional apps for the world's most popular mobile platform using Android Studio and Kotlin.,Lyla Fujiwara| Dan Galpin| Aleks Haecky| Sean McQuillan| Asser Samak| Murat Yener,,,,,,"<?xml version=""1.0""?><mainmodule><module1><heading>Build Your First App</heading><subheading><item1>Explore the basics of Android, such as creating text, images, and interactive buttons</item1><item2>Learn different kinds of views and resources</item2><item3>Learn how to build apps that contain multiple screens known as destinations</item3><item4>Learn all about the Android Activity Lifecycle</item4><item5>Learn one way to structure an Android app and the benefits that come with this design</item5><item6>Build a Sleep Quality Tracker app and use a database to store the data over time</item6><item7>Use RecyclerView to make significant improvements in the UI of your app</item7><item8>Build an application that connects to an internet server to retrieve and display live data</item8><item9>Learn how to implement offline caching by building an app that lets users watch DevByte videos</item9><item10>Improve your app design to support multiple languages as well as support multiple device sizes and orientations</item10></subheading></module1><module2><heading>Layouts</heading><subheading><item1>Set up the development environment and create a Dice Roller Android app</item1><item2>Explore arranging elements with the Android Studio's Layout Editor</item2><item3>Use Android Studio tools to create and visualize a map, or graph, of destinations that show navigation paths in your app</item3><item4>Create a one-screen app called Dessert pusher</item4><item5>Learn about two classes in the lifecycle library: ViewModel and LiveData</item5><item6>Use SQLite to manage your database</item6></subheading></module2><module3><heading>App Navigation</heading><subheading><item1>Navigate the Main Map Anatomy of an Android app</item1><item2>Connect views with data through data binding</item2><item3>Learn the navigation patterns and user interface that Android users expect to see, so that your app will be intuitive and familiar</item3><item4>Debug common issues through an understanding of lifecycles</item4></subheading></module3><module4><heading>Activity & Fragment Lifecycle</heading><subheading></subheading></module4><module5><heading>App Architecture (UI Layer)</heading><subheading></subheading></module5><module6><heading>App Architecture (Data Layer)</heading><subheading></subheading></module6><module7><heading>RecyclerView</heading><subheading></subheading></module7><module8><heading>Connect to the Internet</heading><subheading></subheading></module8><module9><heading>Behind the Scenes</heading><subheading></subheading></module9><module10><heading>Designing for Everyone</heading><subheading></subheading></module10></mainmodule>",Free,,
<200 https://www.udacity.com/course/browser-rendering-optimization--ud860>,Browser Rendering Optimization,<p> to users. Web developers need to build apps that react quickly and render smoothly.</p>,"See the , for using Udacity.","Udacity's Intro to Programming is your first step towards careers in Web and App Development, Machine Learning, Data Science, AI, and more! This program is perfect for beginners.",Cameron Pittman| Paul Lewis,,,,,,"<?xml version=""1.0""?><mainmodule><module1><heading>The Critical Rendering Path</heading><subheading><item1>Introduction to the course with Paul Lewis.</item1><item2>How to recognize the four distinct phases in an app's lifecycle: Response, Animation, Idle and Load (RAIL).</item2><item3>How to make sense of the Timeline panel in Chrome DevTools.</item3><item4>How to optimize JavaScript to hit 60fps during animations.</item4><item5>Learn how accessing the wrong CSS properties can create loads of extra work for the browser.</item5><item6>Practice profiling layer and paint performance with the paint profiler tool in the DevTools Timeline.</item6></subheading></module1><module2><heading>App Lifecycles</heading><subheading><item1>Learn how the browser turns HTML into pixels on the page</item1><item2>How your frame budget changes depending on where the user is in RAIL.</item2><item3>Practice profiling a few different apps to find the source of jank.</item3><item4>How to move expensive JavaScript operations off the main thread and into Web Workers.</item4><item5>Learn how to debug multiple instances of Forced Synchronous Layout.</item5><item6>Learn how to optimize layers to reduce the number of steps the browser needs to take to render each frame.</item6></subheading></module2><module3><heading>Weapons of Jank Destruction</heading><subheading><item1>See how different CSS styles affect the rendering pipeline differently.</item1><item2>Practice thinking through app workloads at different stages in RAIL.</item2></subheading></module3><module4><heading>JavaScript</heading><subheading></subheading></module4><module5><heading>Styles and Layout</heading><subheading></subheading></module5><module6><heading>Compositing and Painting</heading><subheading></subheading></module6></mainmodule>",Free,,
<200 https://www.udacity.com/course/android-basics-data-storage--ud845>,Android Basics: Data Storage,"<p>In this course, you will learn about the importance of data persistence when building an Android app. We'll introduce you to the fundamentals of SQL, the programming language needed to interact with an SQLite relational database. SQLite is a commonly used method to store large sets of data locally on an Android device. </p>","This course assumes you have taken ,, ,, and ,. ,You will also need Android Studio installed on your computer.,See the , for using Udacity.",No programming experience? No Problem! Start developing Android apps today.,Katherine Kuan| Jessica Lin,,,,,,"<?xml version=""1.0""?><mainmodule><module1><heading>Using SQLite</heading><subheading><item1>Learn how to store app data in an SQLite database - a widely used industry data structure.</item1><item2>Hook up a database to your Android app.</item2><item3>Learn how basics of a ContentProvider and add one to your app.</item3><item4>Learn how automatically load data using a CursorAdapter and CursorLoader into a scrollable list.</item4></subheading></module1><module2><heading>Adding SQLite to Your App</heading><subheading><item1>Efficiently structure your app data tables.</item1><item2>Setup a Contract class.</item2><item3>Learn to design URIs for your ContentProvider.</item3><item4>Allow users to select and edit information they've saved off.</item4></subheading></module2><module3><heading>Building a ContentProvider</heading><subheading><item1>Learn the basics of SQL and practice reading, modifying, and deleting data from a database.</item1><item2>Read and write information from the database and handle a Cursor object.</item2><item3>Implement the required functions to use your ContentProvider.</item3><item4>Polish the menus and layouts in your app.</item4></subheading></module3><module4><heading>Using a CursorAdapter and CursorLoader</heading><subheading></subheading></module4></mainmodule>",Free,,
<200 https://www.udacity.com/course/android-basics-networking--ud843>,Android Basics: Networking,<p>This course is a part of the </p>,"The only pre-requisites for this course are the , and the ,. Once you've completed both, you'll be ready to continue your education and learn to build networked apps with this course! ,As with those classes, however, you do need a computer that can run Android Studio (see , for details).,See the , for using Udacity.",No programming experience? No Problem! Start developing Android apps today.,Chris Lei| Joe Lewis,,,,,,"<?xml version=""1.0""?><mainmodule><module1><heading>JSON Parsing</heading><subheading><item1>Discover the power of Web Apis and how they can be used in an Android App.</item1><item2>Harness the essentials of the Hypertext Transfer Protocol to exchange data between an Android device and a web server.</item2><item3>Learn about how you can use threads to do time consuming work in the background while keeping an Android App's User Interface fast and responsive.</item3></subheading></module1><module2><heading>HTTP Networking</heading><subheading><item1>Get practice reading API documentation and learn how to request data from an API using a web browser.</item1><item2>Learn about the components that are needed to compose an HTTP GET Request.</item2><item3>Get a comprehensive overview of AsyncTask and Loaders, two important threading options exposed by the Android Framework.</item3></subheading></module2><module3><heading>Threads and Parallelism</heading><subheading><item1>Learn the essentials of JSON, a common HTTP Response format.</item1><item2>Harness the HttpUrlConnection class to compose a request to the USGS API.</item2><item3>Discover how to persist user settings using Shared Preferences.</item3></subheading></module3></mainmodule>",Free,,
<200 https://www.udacity.com/course/scalable-microservices-with-kubernetes--ud615>,Scalable Microservices with Kubernetes,"<p>This course is designed to teach you about managing application containers, using Kubernetes. We've built this course in partnership with experts such as Kelsey Hightower and Carter Morgan from Google and Netflix’s former Cloud Architect, Adrian Cockcroft (current Technology Fellow at Battery Ventures), who provide critical learning throughout the course. </p>","Prior to taking this course you should possess the following experience and skills:,See the , for using Udacity.","In this program you will master Supervised, Unsupervised, and Deep Learning fundamentals. You will also complete a capstone project in your chosen domain.",Carter Morgan| Kelsey Hightower| Gundega Dekena,,,,,,"<?xml version=""1.0""?><mainmodule><module1><heading>Introduction to Microservices</heading><subheading><item1>Learn how 12-factor apps and the microservices design pattern make modern applications easier to deploy and maintain.</item1><item2>Use Docker to build container images that package an application and its dependencies for deployment on a single machine.</item2><item3>The infrastructure to support an application at scale is as important as the application itself.</item3><item4>Go beyond the theoretical concepts and try out Kubernetes so that you can use it to manage real world apps.</item4></subheading></module1><module2><heading>Building the Containers with Docker</heading><subheading></subheading></module2><module3><heading>Kubernetes</heading><subheading></subheading></module3><module4><heading>Deploying Microservices</heading><subheading></subheading></module4></mainmodule>",Free,,
<200 https://www.udacity.com/course/introduction-to-operating-systems--ud923>,Introduction to Operating Systems,"<p>Introduction to Operating Systems is a graduate-level introductory course in operating systems. This course teaches the basic operating system abstractions, mechanisms, and their implementations. The core of the course contains concurrent programming (threads and synchronization), inter process communication, and an introduction to distributed operating systems. The course is split into four sections: (1) Introduction, (2) Process and Thread Management, (3) Resource Management and Communication, and (4) Distributed Systems.</p>","To undertake this course, you should have taken an undergraduate level course on, or be otherwise familiar with, basic hardware and software aspects of computer systems organization. Prior programming experience with C is recommended, as C is required for the practical component of this course.,For other requirements, see ,.,See the , for using Udacity.","Master job-ready autonomous flight software engineering skills as you tackle advanced challenges, write real code for real aircraft, and develop a systems understanding of the Flying Car full-stack.",Ada Gavrilovska| Jarrod Parkes,,,,,,"<?xml version=""1.0""?><mainmodule><module1><heading>Introduction</heading><subheading><item1>Course Overview</item1><item2>Processes and Process Management</item2><item3>Scheduling</item3><item4>Remote Services</item4></subheading></module1><module2><heading>Process and Thread Management</heading><subheading><item1>Introduction to Operating Systems</item1><item2>Threads and Concurrency</item2><item3>Memory Management</item3><item4>Distributed File Systems</item4></subheading></module2><module3><heading>Resource Management and Communication</heading><subheading></subheading></module3><module4><heading>Distributed Systems</heading><subheading></subheading></module4></mainmodule>",Free,,
<200 https://www.udacity.com/course/intro-to-ios-app-development-with-swift--ud585>,Intro to iOS App Development with Swift,"<p>In this course we will build an iPhone app that records a conversation between you and a friend, and then makes your voices sound like a Chipmunk or Darth Vader.</p>","This course assumes prior programming experience. Specifically, you should have a strong understanding of programming concepts like variables, if statements, loops, functions, and classes. Lesson 1 of , and , are good courses to take if you are completely new to programming.,You will also need access to a Mac computer running OS X 10.10 or later.,We have designed this course such that you will not need a physical device (i.e. an iPhone or an iPad) to build your app. We will be using a simulator on your mac that will imitate the features of a phone on your computer. Towards the end of the course we will provide instructions on how to download your app on an iPhone (in case you do have access to a physical device.),See the , for using Udacity.","Udacity's Intro to Programming is your first step towards careers in Web and App Development, Machine Learning, Data Science, AI, and more! This program is perfect for beginners.",Jarrod Parkes,,,,,,"<?xml version=""1.0""?><mainmodule><module1><heading>Introduction to Swift and Xcode: the tools of iOS</heading><subheading><item1>Learn all the Swift you need to know in 5 min.</item1><item2>Learn Storyboard and AutoLayout, the tools used to build user interfaces in iOS.</item2><item3>The UIViewController class, View Controller Lifecycle, and Multiple Views.</item3><item4>Learn about the AVFoundation class, AVAudioRecorder.</item4><item5>Setup audio playback including rate, pitch, echo, and reverb.</item5></subheading></module1><module2><heading>iOS App Structure: AutoLayout and Buttons</heading><subheading><item1>Take a tour of Xcode, Apple's integrated development environment.</item1><item2>Start developing the Pitch Perfect App and creating the UI.</item2><item3>Learn how to react to touch events and change the user interface.</item3><item4>Setup audio recording in the Pitch Perfect App.</item4><item5>Use UIStackViews to create an elegant layout for your app's UIButtons.</item5></subheading></module2><module3><heading>Using ViewControllers to build an app with Multiple Views</heading><subheading><item1>Get to know the Model View Controller, or MVC, design pattern</item1><item2>Use Autolayout constraints to control the placement of UIButtons and UILabels on the screen.</item2><item3>Add a second screen to your app using a UINavigationController.</item3><item4>Practice using the Delegation pattern and implement programmatic segues.</item4><item5>Use class extensions to add functionality to your app.</item5></subheading></module3><module4><heading>How to record audio and use the Delegation Design Pattern.</heading><subheading></subheading></module4><module5><heading>Playback Sound and Add Sound Effects</heading><subheading></subheading></module5></mainmodule>",Free,,
<200 https://www.udacity.com/course/building-high-conversion-web-forms--ud890>,Building High Conversion Web Forms,"<p>Any meaningful experience on the web has a form. Whether it's a form made of text boxes, toggles, buttons, checkboxes, or touchable widgets, web developers need to be purposeful about forms to make users happy and increase </p>","We expect that you have experience building websites front-ends from scratch and want to learn best practices for forms.,We expect that you are comfortable reading and writing HTML, CSS and JavaScript.,If you are unsure if you're ready, we recommend taking:,See the , for using Udacity.",Learn how to build high quality websites and dynamic applications to create stunning user experiences for the web.,Ido Green| Cameron Pittman,,,,,,"<?xml version=""1.0""?><mainmodule><module1><heading>Efficient Inputs Part 1</heading><subheading><item1>Introduction to the principles of useful forms with Ido Green.</item1><item2>Exercise best practices for implementing input labels and types with many sample inputs.</item2><item3>Explore techniques for making forms faster and easier for users.</item3><item4>Explore best practices for responding to and designing user interactions on mobile.</item4></subheading></module1><module2><heading>Efficient Inputs Part 2</heading><subheading><item1>How to research HTML5 input types.</item1><item2>How to validate user input with HTML5 attributes.</item2><item3>Practice empathy for your users in order to simplify and expedite forms.</item3><item4>Use touch events to build a mobile-ready touch slider.</item4></subheading></module2><module3><heading>Fast Forms</heading><subheading><item1>How to build a datalist input.</item1><item2>How to validate user input using JavaScript and the Constraint Validation API.</item2><item3>Apply everything you've learned so far by designing and building an e-commerce checkout.</item3><item4>Introduction to the final project - an event planner app!</item4></subheading></module3><module4><heading>Touch Support</heading><subheading></subheading></module4></mainmodule>",Free,,
<200 https://www.udacity.com/course/advanced-android-app-development--ud855>,Advanced Android App Development,"<p>Ready to level-up your skills as an Android developer? In this course, you will learn how to make your app production-ready by developing a variety of different sample apps, each designed to showcase advanced capabilities of the Android platform, including fragments, widgets, media playback, and testing. You’ll learn how to create UI tests using the Espresso framework, to leverage third-party libraries and services like ExoPlayer and Firebase Cloud Messaging, and use Google APIs to make your app aware of its location. By the end of the course, you’ll know how to publish your own app to the Google Play Store, where you can reach and engage users across the globe.</p>","This course assumes you have taken ,, or have an equivalent background as an Android developer. We also assume you are familiar with using GitHub, which we use to share code. Take our course on , if you need this background.,Access to an Android device is helpful, but you may use an emulator if you prefer.,See the , for using Udacity.",Master Android development with Kotlin and build professional apps for the world's most popular mobile platform using Android Studio and Kotlin.,Lyla Fujiwara| Cezanne Camacho| Asser Samak| Nikita Gamolsky| Jessica Lin| Dan Galpin,,,,,,"<?xml version=""1.0""?><mainmodule><module1><heading>Fragments</heading><subheading><item1>Use fragments to build responsive and flexible layouts</item1><item2>Save time and increase your app’s functionality by leveraging libraries</item2><item3>Use Firebase Cloud Messaging to connect an app to a server</item3><item4>Use Google APIs to make your app aware of its location</item4><item5>Use ExoPlayer, an open source library, to implement a media player</item5><item6>Make your app stand out with widgets</item6><item7>Learn about the Android Testing Support Library</item7><item8>Review the final steps to getting your app production ready</item8></subheading></module1><module2><heading>Libraries</heading><subheading><item1>Build an AndroidMe app to create and customize Android characters</item1><item2>Learn how to implement the Google Mobile Vision library for facial recognition</item2><item3>Build a Squawker app to deliver instructor messages (“squawks”) to users</item3><item4>Build a ShushMe app that silences your phone based on its location</item4><item5>Build a Classical Music Quiz app that renders audio and video</item5><item6>Allow users to interact more frequently with your app</item6><item7>Use Espresso to run user interface (UI) testing on your app</item7><item8>Learn how to prepare and test your app for release to the Google Play Store</item8></subheading></module2><module3><heading>Firebase Cloud Messaging</heading><subheading><item1>Use the principles of Material Design to ensure your app works on multiple screen sizes</item1></subheading></module3><module4><heading>Places</heading><subheading></subheading></module4><module5><heading>Media Playback</heading><subheading></subheading></module5><module6><heading>Widgets</heading><subheading></subheading></module6><module7><heading>Espresso</heading><subheading></subheading></module7><module8><heading>Publishing Your App</heading><subheading></subheading></module8></mainmodule>",Free,,
