response,title,main_desc,prerequisite,what_u_learn,instructor,inst_desig,inst_bio,total_duration,total_duration_unit,course_start_date,contents,display_price,emi,currency
<200 https://www.udacity.com/course/version-control-with-git--ud123>,Version Control with Git,"<p>This course covers the essentials of using the version control system Git. You'll be able to create a new Git repo, commit changes, and review the commit history of an existing repo. You'll also learn how to keep your commits organized using tags and branches and you'll master the art of merging changes by crushing those pesky merge conflicts. Oh no! Was a mistake made along the way? Learn how to edit commits, revert changes, or even delete commits.</p>","This course is ideal for developers of all skill levels. Experience with the command line is beneficial, but not required.,See the , for using Udacity.",React is completely transforming Front-End Development. Master this powerful UI library from Facebook with Udacity.,Richard Kalehoff,,,,,,"<?xml version=""1.0""?><mainmodule><module1><heading>Purpose & Terminology</heading><subheading><item1>Learn why developers use version control and discover ways you use version control in your daily life</item1><item2>Create your first Git repository with git init</item2><item3>Review a repo's commit history git log</item3><item4>Master the Git workflow and make commits to an example project</item4><item5>Organize your commits with tags and branches</item5><item6>Learn how and when to edit or delete an existing commit</item6></subheading></module1><module2><heading>Create a Git Repo</heading><subheading><item1>Get an overview of essential Git vocabulary</item1><item2>Copy an existing Git repository with git clone</item2><item3>Customize git log's output using command line flags in order to reveal more (or less) information about each commit</item3><item4>Use git diff to identify what parts of a file have been changed in a commit</item4><item5>Jump to particular tags and branches using git checkout</item5><item6>Use git commit's --amend flag to alter the last commit</item6></subheading></module2><module3><heading>Review a Repo's History</heading><subheading><item1>Configure Git using the command line</item1><item2>Review the current state of a repository with the powerful git status</item2><item3>Use the git show command to display just one commit</item3><item4>Learn how to mark files as ""untracked"" using .gitignore</item4><item5>Learn how to merge together changes on different branches and crush those pesky merge conflicts</item5><item6>Use git reset and git revert to undo and erase commits</item6></subheading></module3><module4><heading>Add Commits to a Repo</heading><subheading></subheading></module4><module5><heading>Tagging, Branching, and Merging</heading><subheading></subheading></module5><module6><heading>Undoing Changes</heading><subheading></subheading></module6></mainmodule>",Free,,
<200 https://www.udacity.com/course/advanced-operating-systems--ud189>,Advanced Operating Systems,"<p>In this course, we will see all the advances that have led to the state-of-the-art operating system that we know today, covering variety of platforms -- cell phones, multi-core, parallel systems, distributed systems, and cloud computing.</p>","Students are expected to have taken an undergraduate OS course, or have some experience in industry. A good understanding of the concepts in a standard textbook such as ""Operating Systems Concepts,"" Silberschatz and Galvin (or its equivalent) will be assumed in this course. ,Students must also be comfortable with UNIX and C programming.,See the , for using Udacity.","Start your career as an Android developer. Learn best practices for mobile development, build a portfolio of apps, and publish your own app to Google Play.",Kishore Ramachandran| Charles Brubaker,,,,,,"<?xml version=""1.0""?><mainmodule><module1><heading>Abstractions</heading><subheading><item1>Hardware Resources</item1><item2>The SPIN Approach</item2><item3>Intro to Virtualization</item3><item4>Shared Memory Machines</item4><item5>Definitions</item5><item6>Spring Operating System</item6><item7>Global Memory System</item7><item8>Lightweight Recoverable Virtual Memory</item8><item9>Giant Scale Services</item9><item10>Time sensitive Linux</item10></subheading></module1><module2><heading>OS Structure</heading><subheading><item1>OS Functionality</item1><item2>The Exokernel Approach</item2><item3>Memory Virtualization</item3><item4>Synchronization</item4><item5>Lamport Clocks</item5><item6>Java RMI</item6><item7>Distributed Shared Memory</item7><item8>Rio Vista</item8><item9>MapReduce</item9><item10>Persistent temporal streams</item10></subheading></module2><module3><heading>Virtualization</heading><subheading><item1>Managing the CPU and Memory</item1><item2>The L3 Micro-Kernel Approach</item2><item3>CPU and Device Virtualization</item3><item4>Communication</item4><item5>Latency limits</item5><item6>Enterprise Java Beans</item6><item7>Distributed File System</item7><item8>Quicksilver</item8><item9>Content Delivery Networks</item9></subheading></module3><module4><heading>Parallelism</heading><subheading></subheading></module4><module5><heading>Distributed Systems</heading><subheading></subheading></module5><module6><heading>Distributed Object Technology</heading><subheading></subheading></module6><module7><heading>Design and Implementation of Distributed Services</heading><subheading></subheading></module7><module8><heading>System Recovery</heading><subheading></subheading></module8><module9><heading>Internet Scale Computing</heading><subheading></subheading></module9><module10><heading>Real-Time and Multimedia</heading><subheading></subheading></module10></mainmodule>",Free,,
<200 https://www.udacity.com/course/firebase-in-a-weekend-by-google-ios--ud0351>,Firebase in a Weekend: iOS,"<p>In this course, you’ll learn how to use Firebase. Firebase is app development platform that provides developers a variety of tools and a scalable infrastructure to build high quality apps. </p>","You need to have proficiency in building an iOS mobile application, including experience in basic command line, calling a web or cloud API, working with the view controller life cycle, using multiple view controllers, and working with UITableViewController (iOS Developer Nanodegree or equivalent level). Familiarity working with a web service from iOS, using Core Data, or building apps that use databases will also be helpful.,See the , for using Udacity.","Udacity's Intro to Programming is your first step towards careers in Web and App Development, Machine Learning, Data Science, AI, and more! This program is perfect for beginners.",Frank van Puffelen| Laurence Moroney| Jarrod Parkes| Jennifer Person,,,,,,"<?xml version=""1.0""?><mainmodule><module1><heading>Saturday</heading><subheading><item1>Why Choose Firebase</item1><item2>Storing Data</item2><item3>Introduction to Cloud Functions for Firebase</item3></subheading></module1><module2><heading>Sunday</heading><subheading><item1>Creating a Firebase Project</item1><item2>Leveraging Analytics to Improve User Engagement</item2><item3>Deploy Cloud Functions using the Firebase CLI</item3></subheading></module2><module3><heading>Monday</heading><subheading><item1>Reading and Writing using Firebase Realtime Database and Authentication</item1><item2>Notifications and Remote Config</item2><item3>Extend mobile app functionality with server-side code</item3></subheading></module3></mainmodule>",Free,,
<200 https://www.udacity.com/course/deploying-applications-with-heroku--ud272>,Deploying Applications with Heroku,"<p>This course will introduce you to web deployment platforms. You’ll begin by deploying your first web application to the Heroku platform, making it publicly available on the internet. In the process, you will learn about the underlying mechanics of web hosting. You will also learn how to configure your app, from accessing log output to configuring environment variables.</p>","You should have experience with Git, GitHub, and using the command line. Experience with at least one object-oriented language like Ruby or Python is also expected. Knowledge of micro-frameworks like Sinatra or Flask is recommended, but not required.,See the , for using Udacity.","Udacity's Intro to Programming is your first step towards careers in Web and App Development, Machine Learning, Data Science, AI, and more! This program is perfect for beginners.",Diego Lugo,,,,,,"<?xml version=""1.0""?><mainmodule><module1><heading>Deployment in a Flash</heading><subheading><item1>Deploy your very first web application with Heroku.</item1><item2>Learn the underlying mechanics of how web servers work.</item2></subheading></module1><module2><heading>Common Functionality</heading><subheading><item1>Learn the basics of deployment.</item1><item2>Identify common challenges when working with a deployed application.</item2></subheading></module2></mainmodule>",Free,,
<200 https://www.udacity.com/course/computability-complexity-algorithms--ud061>,"Computability, Complexity & Algorithms","<p>In this course, we will ask the big questions, ""What is a computer? What are the limits of computation? Are there problems that no computer will ever solve? Are there problems that can’t be solved quickly? What kinds of problems can we solve efficiently and how do we go about developing these algorithms?"" Understanding the power and limitations of algorithms helps us develop the tools to make real-world computers smarter, faster and safer.</p>","Students are expected to have a solid grasp of the basics of discrete mathematics.  Discrete Mathematics and Its Applications by Ken Rosen provides an excellent background for this course. ,If you answer ""no"" to any of the following questions, it may be beneficial to acquire background knowledge concurrently or prior to taking the course.,See the , for using Udacity.","In this program you will master Supervised, Unsupervised, and Deep Learning fundamentals. You will also complete a capstone project in your chosen domain.",Charles Brubaker| Lance Fortnow| Hariharan Venkateswaran,,,,,,"<?xml version=""1.0""?><mainmodule><module1><heading>Computability</heading><subheading><item1>Languages & Countability</item1><item2>P and NP</item2><item3>Dynamic Programming</item3></subheading></module1><module2><heading>Complexity</heading><subheading><item1>Turing Machines</item1><item2>NP-Complete Problems</item2><item3>Fast Fourier Transform</item3></subheading></module2><module3><heading>Algorithms</heading><subheading><item1>The Church-Turing Thesis</item1><item2>The Golden Ticket</item2><item3>Maximum Flow</item3></subheading></module3></mainmodule>",Free,,
<200 https://www.udacity.com/course/passwordless-login-solutions-for-ios--ud1028>,Passwordless Login Solutions for iOS,"<p>For an app developer, providing a seamless user experience is critical for building engagement and growing a user base. Passwordless login solutions provide your users with a simple, secure, and positive first experience.</p>","To get the most out of this course, you should have at least 3 months experience developing iOS apps in Swift, and familiarity using a third party SDK. If you lack this experience, please take our , course prior to enrolling in this one. We also recommend taking , if you have experience with iOS Apps but are new to Swift. ,To follow along with course activities, you must create a , account, which will provide access to the Facebook Platform.,See the , for using Udacity.","Udacity's Intro to Programming is your first step towards careers in Web and App Development, Machine Learning, Data Science, AI, and more! This program is perfect for beginners.",Gabrielle Miller-Messner,,,,,,"<?xml version=""1.0""?><mainmodule><module1><heading>Introduction to Passwordless Login Solutions</heading><subheading><item1>Learn why users’ login preferences are so critical for your app</item1><item2>Create your Facebook for Developers account</item2><item3>Configure authentication with Facebook Login for a sample app</item3><item4>Learn strategies for handling many types of Facebook Authentication cases</item4><item5>Understand the best practices for asking permission from users to access their Facebook data</item5></subheading></module1><module2><heading>Account Kit</heading><subheading><item1>Discover how Account Kit and Facebook Login positively impact the login experience</item1><item2>Configure authentication with Account Kit in a sample app</item2><item3>Learn best practices for asking users for permissions</item3><item4>Test your app’s Login flow against these common use cases</item4><item5>Use the Graph API to add social features to an app</item5></subheading></module2><module3><heading>Facebook Login</heading><subheading><item1>Explore ways these solutions can expand the reach of your app</item1><item2>Track app events and analytics</item2><item3>Explore Facebook Login analytics from real partner apps</item3></subheading></module3><module4><heading>Testing Login Flow</heading><subheading></subheading></module4><module5><heading>Introduction to the Graph API</heading><subheading></subheading></module5></mainmodule>",Free,,
<200 https://www.udacity.com/course/http-web-servers--ud303>,HTTP & Web Servers,"<p>This course is intended for budding full-stack web developers to master the basics of HTTP, the protocol that underlies all web technology.</p>","In this course, you will run commands on your computer using a Unix-like shell environment (command line). A basic familiarity with the terminal, working with files and command-line programs, and the , version control software will be very useful.,You will read and write object-oriented Python code using a text editor, and will read Python module documentation to learn about new modules. You will also write code that sends HTML to browsers, so a basic knowledge of HTML markup will come in handy. CSS and JavaScript are not required.,This course does not use a virtual machine (VM). You will be installing and writing software on your own computer. You will need a text editor and the ability to install software.,Elements of this course require communicating with web services including Github and Heroku.,See the , for using Udacity.","Udacity's Intro to Programming is your first step towards careers in Web and App Development, Machine Learning, Data Science, AI, and more! This program is perfect for beginners.",Karl Krueger,,,,,,"<?xml version=""1.0""?><mainmodule><module1><heading>Requests & Responses</heading><subheading><item1>Explore HTTP by running a web server on your own computer</item1><item2>Write code that speaks HTTP both as a server and a client</item2><item3>Connect your knowledge of HTTP basics with the rest of the world</item3></subheading></module1><module2><heading>The Web from Python</heading><subheading><item1>Interact with servers and browsers from the command line</item1><item2>Build Python code that accepts HTML form submissions, accesses web services, and constructs formatted responses</item2><item3>Deploy services you've written so that other people can see them</item3></subheading></module2><module3><heading>HTTP in the Real World</heading><subheading><item1>Discover HTTP requests and responses, headers, status codes, and other features of the protocol</item1></subheading></module3></mainmodule>",Free,,
<200 https://www.udacity.com/course/embedded-systems--ud169>,Embedded Systems,"<p>In the 21st century, embedded systems are the systems of future with cellular phones, smart-phones, tablets becoming the dominant platforms for computing and communication. The ubiquity of information and the associated need for the computation that accompanies it is driving this revolution only to be accelerated by the new paradigms such as the Internet-of-Things (IoT). These platforms are clearly very different in terms of their processing requirements which are very unique: real-time needs, high performance but at low energy, compact-code and data segments, and most importantly ever changing software stack. Such unique requirements have led to a complete redesign and reinvention of the both hardware and the software stack from ground up, for example, brand new processors such as ARM, DSPs, network processors were invented all the way up to new virtual machines such as Dalvik, new operating systems such as Android and new programming models and compiler optimizations.</p>","It is recommended that students who take this course have previously taken at least an undergraduate-level course in computer architecture. In addition, the students must have a strong background in C and/or C++.,See the , for using Udacity.","Master job-ready autonomous flight software engineering skills as you tackle advanced challenges, write real code for real aircraft, and develop a systems understanding of the Flying Car full-stack.",Santosh Pande| Catherine Gamboa,,,,,,"<?xml version=""1.0""?><mainmodule><module1><heading>Embedded Processor Architectures</heading><subheading><item1>Instruction-Level Parallelism</item1><item2>Compiler Phases</item2><item3>Data Layouts for Embedded Processors</item3></subheading></module1><module2><heading>Software Optimizations</heading><subheading><item1>Design of Instruction Set Architectures</item1><item2>Register Allocation Foundation</item2><item3>Data and Code Compaction</item3></subheading></module2><module3><heading>Advanced Optimizations</heading><subheading><item1>Embedded Micro-architectures</item1><item2>Register Allocation for Embedded Processors</item2><item3>Network Processors</item3></subheading></module3></mainmodule>",Free,,
<200 https://www.udacity.com/course/the-mvc-pattern-in-ruby--ud270>,The MVC Pattern in Ruby,"<p>Learn how to organize the code for your web apps, and why it's important. You’ll be using the MVC Design Pattern in the web application micro-framework, Sinatra.</p>","This course is ideal for intermediate Ruby programmers who have experience rendering static pages using the Sinatra web development micro-framework.,Students should be proficient in HTML and CSS.,See the , for using Udacity.","Udacity's Intro to Programming is your first step towards careers in Web and App Development, Machine Learning, Data Science, AI, and more! This program is perfect for beginners.",Julia Van Cleve,,,,,,"<?xml version=""1.0""?><mainmodule><module1><heading>The MVC Design Pattern with Ruby</heading><subheading><item1>Learn about the challenges of developing a website with disorganized code.</item1></subheading></module1></mainmodule>",Free,,
<200 https://www.udacity.com/course/asynchronous-javascript-requests--ud109>,Asynchronous JavaScript Requests,"<p>This course covers everything a developer needs to know to asynchronously send and receive data in their web applications. You'll dive into how asynchronous requests work by using the XHR object to create and send asynchronous requests for image and news article data. Then, you'll see how you can perform async requests more easily using third-party libraries and APIs like jQuery's Ajax and the Fetch API.</p>","This course is ideal for students with intermediate level knowledge of JavaScript. You should have experience working with JavaScript's Object Oriented (prototypal inheritance) capabilities and using native JavaScript Promises. To brush up on these skills, check out , and ,.,See the , for using Udacity.","Udacity's Intro to Programming is your first step towards careers in Web and App Development, Machine Learning, Data Science, AI, and more! This program is perfect for beginners.",Richard Kalehoff,,,,,,"<?xml version=""1.0""?><mainmodule><module1><heading>Lesson 1: Ajax with XHR</heading><subheading><item1>Learn why you should use asynchronous data requests</item1><item2>Compare using XHR with using a third-party library like jQuery's Ajax</item2><item3>Use JavaScript promises to create a fetch request and handle the data asynchronously</item3></subheading></module1><module2><heading>Lesson 2: Ajax with jQuery</heading><subheading><item1>Use the XHR (XMLHTTPRequest) object to send and receive data asynchronously</item1><item2>Send and receive data using jQuery's Ajax methods</item2><item3>Learn how to handle errors for failed requests</item3></subheading></module2><module3><heading>Lesson 3: Ajax with Fetch</heading><subheading></subheading></module3></mainmodule>",Free,,
<200 https://www.udacity.com/course/intro-to-algorithms--cs215>,Intro to Algorithms,"<p>Ever played the Kevin Bacon game? This class will show you how it works by giving you an introduction to the design and analysis of algorithms, enabling you to discover how individuals are connected. </p>","This class assumes an understanding of programming at the level of CS101, including the ability to read and write short programs in Python; it also assumes a comfort level with mathematical notation at the level of high school Algebra II or the SATs.,See the , for using Udacity.","Udacity's Intro to Programming is your first step towards careers in Web and App Development, Machine Learning, Data Science, AI, and more! This program is perfect for beginners.",Michael Littman,,,,,,"<?xml version=""1.0""?><mainmodule><module1><heading>A Social Network Magic Trick</heading><subheading><item1>Become familiar with algorithm analysis.</item1><item2>Use mathematical tools to analyze how things are connected.</item2><item3>Find the quickest route to Kevin Bacon.</item3><item4>Learn to keep track of your best friends using heaps.</item4><item5>Work with social networks that have edge weights.</item5><item6>Explore what it means for a social network problem to be ""harder"" than other.</item6><item7>Interview with Peter Winker (Professor, Dartmouth College) on names and boxes problem and puzzles and algorithms.</item7></subheading></module1><module2><heading>Growth Rates in Social Networks</heading><subheading><item1>Eulerian Path and Correctness of Na.</item1><item2>Chain, ring and grid networks.</item2><item3>Properties of social networks.</item3><item4>Degree centrality.</item4><item5>Make a tree and strength of connections.</item5><item6>Tetristan and Exponential Running Time</item6><item7>Interview with Tina Eliassi-Rad (Professor, Rutgers University) on statistical measures in network and social networks in security and protests.</item7></subheading></module2><module3><heading>Basic Graph Algorithms</heading><subheading><item1>Russian peasants algorithm and more.</item1><item2>Big Theta and more.</item2><item3>Clustering coefficient and more.</item3><item4>Top K Via Partitioning and more.</item4><item5>Weighted social networks and more.</item5><item6>Degrees of hardness and more.</item6><item7>Additional interviews with Andrew Goldberg (Microsoft Research), Vukosi Marivate (Rutgers University) and Duncan Watts (Microsoft).</item7></subheading></module3><module4><heading>It's Who You Know</heading><subheading></subheading></module4><module5><heading>Strong and Weak Bonds</heading><subheading></subheading></module5><module6><heading>Hardness of Network Problems</heading><subheading></subheading></module6><module7><heading>Review and Application</heading><subheading></subheading></module7></mainmodule>",Free,,
