response,title,main_desc,prerequisite,what_u_learn,instructor,inst_desig,inst_bio,total_duration,total_duration_unit,course_start_date,contents,display_price,emi,currency
<200 https://www.udacity.com/course/ab-testing--ud257>,A/B Testing,"<p>This course will cover the design and analysis of A/B tests, also known as split tests, which are online experiments used to test potential improvements to a website or mobile application. Two versions of the website are shown to different users - usually the existing website and a potential change. Then, the results are analyzed to determine whether the change is an improvement worth launching. This course will cover how to choose and characterize metrics to evaluate your experiments, how to design an experiment with enough statistical power, how to analyze the results and draw valid conclusions, and how to ensure that the the participants of your experiments are adequately protected.</p>","This course requires introductory knowledge of descriptive and inferential statistics. If you haven't learned these topics, or need a refresher, they are covered in the Udacity courses , and ,.,Prior experience with A/B testing is not required, and neither is programming knowledge.,See the , for using Udacity.","Udacity's Intro to Programming is your first step towards careers in Web and App Development, Machine Learning, Data Science, AI, and more! This program is perfect for beginners.",Carrie Grimes| Caroline Buckey| Diane Tang,,,,,,"<?xml version=""1.0""?><mainmodule><module1><heading>Overview of A/B Testing</heading><subheading><item1>This lesson will cover what A/B testing is and what it can be used for.</item1><item2>How to make sure the participants of your experiments are adequately protected.</item2><item3>Learn techniques for brainstorming metrics.</item3><item4>How to choose which users will be in your experiment and control group.</item4><item5>How to analyze the results of your experiments.</item5></subheading></module1><module2><heading>Policy and Ethics for Experiments</heading><subheading><item1>How to construct a binomial confidence interval for the results.</item1><item2>What questions you should be asking regarding the ethicality of experiments.</item2><item3>What to do when you can't measure directly.</item3><item4>When to limit your experiment to a subset of your entire user base.</item4><item5>Run sanity checks to catch problems with the experiment set-up.</item5></subheading></module2><module3><heading>Choosing and Characterizing Metrics</heading><subheading><item1>How to decide whether the change is worth the launch cost.</item1><item2>The four main ethics principles to consider when designing experiments.</item2><item3>Characteristics to consider when validating metrics.</item3><item4>Design decisions affect the size of your experiment.</item4><item5>Check conclusions with multiple methods, including a binomial sign test.</item5></subheading></module3><module4><heading>Designing an Experiment</heading><subheading></subheading></module4><module5><heading>Analyzing Results</heading><subheading></subheading></module5></mainmodule>",Free,,
<200 https://www.udacity.com/course/intro-to-hadoop-and-mapreduce--ud617>,Intro to Hadoop and MapReduce,"<p>The Apache™ Hadoop® project develops open-source software for reliable, scalable, distributed computing. Learn the fundamental principles behind it, and how you can use its power to make sense of your Big Data.</p>","Lesson 1 does not have technical prerequisites and is a good overview of Hadoop and MapReduce for managers.,To get the most out of the class, however, you need basic programming skills in Python on a level provided by introductory courses like our , course.,To learn more about Hadoop, you can also check out the book ,.,See the , for using Udacity.","Udacity's Intro to Programming is your first step towards careers in Web and App Development, Machine Learning, Data Science, AI, and more! This program is perfect for beginners.",Sarah Sproehnle| Ian Wrigley| Gundega Dekena,,,,,,"<?xml version=""1.0""?><mainmodule><module1><heading>Big Data</heading><subheading><item1>What is Big Data?</item1><item2>Discover how HDFS distributes data over multiple computers.</item2><item3>Write your own MapReduce code.</item3><item4>Use common patterns for MapReduce programs to analyze Udacity forum data.</item4></subheading></module1><module2><heading>HDFS and MapReduce</heading><subheading><item1>The problems big data creates.</item1><item2>Learn how MapReduce enables analyzing datasets in parallel across multiple machines.</item2></subheading></module2><module3><heading>MapReduce code</heading><subheading><item1>How Apache Hadoop addresses these problems.</item1></subheading></module3><module4><heading>MapReduce Design Patterns</heading><subheading></subheading></module4></mainmodule>",Free,,
<200 https://www.udacity.com/course/machine-learning--ud262>,Machine Learning,<p>Machine Learning is a graduate-level course covering the area of Artificial Intelligence concerned with computer programs that modify and improve their performance through experiences. </p>,"A strong familiarity with Probability Theory, Linear Algebra and Statistics is required. An understanding of ,, especially ,, would be helpful.,Students should also have some experience in programming (perhaps through ,) and a familiarity with Neural Networks (as covered in ,).,See the , for using Udacity.","Complete real-world projects designed by industry experts, covering topics from asset management to trading signal generation. Master AI algorithms for trading, and build your career-ready portfolio.",Michael Littman| Charles Isbell| Pushkar Kolhe,,,,,,"<?xml version=""1.0""?><mainmodule><module1><heading>Supervised Learning</heading><subheading><item1>Machine Learning is the ROX</item1><item2>Randomized optimization</item2><item3>Markov Decision Processes</item3></subheading></module1><module2><heading>Unsupervised Learning</heading><subheading><item1>Decision Trees</item1><item2>Clustering</item2><item3>Reinforcement Learning</item3></subheading></module2><module3><heading>Reinforcement Learning</heading><subheading><item1>Regression and Classification</item1><item2>Feature Selection</item2><item3>Game Theory</item3></subheading></module3></mainmodule>",Free,,
<200 https://www.udacity.com/course/eigenvectors-and-eigenvalues--ud104>,Eigenvectors and Eigenvalues,<p>One of the most interesting topics to visualize in Linear Algebra are Eigenvectors and Eigenvalues. Here you will learn how to easily calculate them and how they are applicable and particularly interesting when it comes to machine learning implementations.</p>,"To easily understand this class you will need to have mathematical background in Linear Algebra. Refresh your memory or go over the topics of  , , , And , before beginning.,See the , for using Udacity.","Udacity's Intro to Programming is your first step towards careers in Web and App Development, Machine Learning, Data Science, AI, and more! This program is perfect for beginners.",Ortal Arel,,,,,,"<?xml version=""1.0""?><mainmodule><module1><heading>Vectors</heading><subheading><item1>Linear Transformation</item1><item2>Characteristic Equation of a matrix</item2><item3>Principle Component Analysis (PCA)</item3></subheading></module1><module2><heading>Definitions and Calculations</heading><subheading></subheading></module2><module3><heading>Why is the relevant to Machine Learning?</heading><subheading></subheading></module3></mainmodule>",Free,,
<200 https://www.udacity.com/course/intro-to-tensorflow-lite--ud190>,Introduction to TensorFlow Lite,"<p>Learn how to deploy deep learning models on mobile and embedded devices with TensorFlow Lite. This course was developed by the TensorFlow team and Udacity as a practical approach to model deployment for software developers. You'll get hands-on experience with the TensorFlow Lite framework as you deploy deep learning models on Android, iOS, and even an embedded Linux platform. By the end of this course, you'll have all the skills necessary to start deploying your own deep learning models into your apps.</p>","General Experience: Some familiarity with the TensorFlow Lite framework, and comfortability with Object Oriented Programming, Python, Swift, Android, and Machine Learning.,See the , for using Udacity.",Deep learning is driving advances in artificial intelligence that are changing our world. Enroll now to build and apply your own deep neural networks to produce amazing solutions to important challenges.,Daniel Situnayake| Paige Bailey| Juan Delgado,,,,,,"<?xml version=""1.0""?><mainmodule><module1><heading>Introduction to TensorFlow Lite</heading><subheading><item1>Learn how TensorFlow works under the hood</item1><item2>Deploy a TF Lite Model to an Android app that classifies images of cats and dogs</item2><item3>Deploy a TF Lite Model to an iOS app that classifies images of cats and dogs</item3><item4>Deploy a TF Lite Model to a Linux embedded platform that classifies images of cats and dogs</item4></subheading></module1><module2><heading>TensorFlow Lite on Android</heading><subheading><item1>Learn how to quantize models</item1><item2>Deploy a TF Lite Model to an Android app that classifies images of various objects</item2><item3>Deploy a TF Lite Model to an iOS app that classifies images of various objects</item3><item4>Deploy a TF Lite Model to a Linux embedded platform that classifies images of various objects</item4></subheading></module2><module3><heading>TensorFlow Lite on Swift</heading><subheading><item1>Learn how to test your TF Lite Models in Python</item1><item2>Deploy a TF Lite Model to an Android app that performs object detection</item2><item3>Deploy a TF Lite Model to an iOS app that performs object detection</item3><item4>Deploy a TF Lite Model to a Linux embedded platform that performs object detection</item4></subheading></module3><module4><heading>TensorFlow Lite on IoT</heading><subheading></subheading></module4></mainmodule>",Free,,
<200 https://www.udacity.com/course/model-building-and-validation--ud919>,Model Building and Validation,"<p>This course will teach you how to start from scratch in answering questions about the real world using data. Machine learning happens to be a small part of this process. The model building process involves setting up ways of collecting data, understanding and paying attention to what is important in the data to answer the questions you are asking, finding a statistical, mathematical or a simulation model to gain understanding and make predictions. </p>","This is an advanced course, and the ideal students for this class are prepared individuals who have:,See the , for using Udacity.","Udacity's Intro to Programming is your first step towards careers in Web and App Development, Machine Learning, Data Science, AI, and more! This program is perfect for beginners.",Don Dini| Rishi Pravahan,,,,,,"<?xml version=""1.0""?><mainmodule><module1><heading>Introduction to the QMV Process</heading><subheading><item1>Learn about the Question, Modeling, and Validation (QMV) process of data analysis.</item1><item2>Learn how to turn a vague question into a statistical one that can be analyzed with statistics and machine learning.</item2><item3>Build rigorous mathematical, statistical, and machine learning models to make accurate predictions.</item3><item4>Learn fundamental metrics to grade the performance of your models.</item4><item5>Create a program that examines log data and scores the likelihood that a brute force attack is taking place on a server.</item5></subheading></module1><module2><heading>Question Phase</heading><subheading><item1>Understand the basics behind each step.</item1><item2>Analyze a Twitter dataset and try to predict when a person will tweet next!</item2><item3>Look through the recently released U.S. medicare dataset for anomalous transactions.</item3><item4>Analyze the AT&T connected cars data set.</item4></subheading></module2><module3><heading>Modeling Phase</heading><subheading><item1>Apply the QMV process to analyze on how Udacity employees choose candies!</item1></subheading></module3><module4><heading>Validation Phase</heading><subheading></subheading></module4><module5><heading>Identify Hacking Attempts from Network Flow Logs</heading><subheading></subheading></module5></mainmodule>",Free,,
<200 https://www.udacity.com/course/data-visualization-and-d3js--ud507>,Data Visualization and D3.js,"<p>Learn the fundamentals of data visualization and practice communicating with data. This course covers how to apply design principles, human perception, color theory, and effective storytelling to data visualization. If you present data to others, aspire to be an analyst or data scientist, or if you’d like to become more technical with visualization tools, then you can grow your skills with this course.</p>","Regardless of your programming background, you can learn about data visualization and design principles in Lesson 1a and Lesson 2a without the following recommended background.,To succeed in this course, you should to be familiar with basic programming principles, including data types (strings, arrays, booleans, etc.), , statements, and , loops. You should also be able to describe concepts like functions and objects. Our , and , courses are great places to get started.,Basic knowledge of HTML and CSS (structuring and styling a web page) is not required but highly recommended. We suggest taking the , course if you have no experience with HTML or CSS.,This course is unique in that the final project can be completed using either dimple.js or d3.js. The visualization library, dimple.js, is easier to use than d3.js and requires less background knowledge. Furthermore, a graphic can be created in considerably fewer lines of code using dimple.js as opposed to d3.js.,So why should you learn d3.js?,Data Driven Documents (d3.js) allows you to build highly customized graphics. If you would like to gain more technical skills and learn more about Javascript and open web standards, then you should complete Lesson 3 and Lesson 4 in order to prepare for the final project.,If you would like to complete the final project using d3.js, you should have some experience reading and using documentation. For example, you should be able to code a , loop in Javascript or be able to look up the syntax to work with strings and arrays in Javascript. We recommend taking the , course if you have little to no experience with Javascript.,See the , for using Udacity.","Udacity's Intro to Programming is your first step towards careers in Web and App Development, Machine Learning, Data Science, AI, and more! This program is perfect for beginners.",Ryan Orban| Chris Saden| Jonathan Dinu,,,,,,"<?xml version=""1.0""?><mainmodule><module1><heading>Visualization Fundamentals</heading><subheading><item1>Learn about the elements of great data visualization.</item1><item2>Learn how to use the open standards of the web to create graphical elements.</item2><item3>Which chart type to use for a data set.</item3><item4>Create graphics using the Dimple JavaScript library.</item4><item5>Learn how to incorporate different narrative structures into your visualizations.</item5><item6>Learn how to leverage animation and interaction to bring more data insights to your audience.</item6></subheading></module1><module2><heading>Building Blocks</heading><subheading><item1>Meet data visualization experts, learn about data visualization in the context of data science.</item1><item2>Select elements on the page, add SVG elements, and how to style SVG elements.</item2><item3>Colors to avoid when making graphics.</item3><item4>Learn about this library as a gentle coding introduction before learning about D3.js.</item4><item5>Learn about bias in the data visualization process and learn how to add context.</item5><item6>Learn how to create a bubble map for the World Cup data set.</item6></subheading></module2><module3><heading>Design Principles</heading><subheading><item1>Learn how to represent data values in visual form.</item1><item2>Instructor Notes throughout this lesson are available if you have little or no experience with HTML and CSS.</item2><item3>How to determine if a graphic is effective.</item3><item4>Produce great graphics with minimal code and interactivity without any extra effort.</item4></subheading></module3><module4><heading>Dimple js</heading><subheading></subheading></module4><module5><heading>Narratives</heading><subheading></subheading></module5><module6><heading>Animation and Interaction</heading><subheading></subheading></module6></mainmodule>",Free,,
<200 https://www.udacity.com/course/secure-and-private-ai--ud185>,Secure and Private AI,"<p>What’s the earliest we can predict cancer survival rates, and what schools do the best job of educating children? You can only answer these questions with very rare access to private and personal data, but access to this personal data requires that you master methods for the principled protection of user privacy. While not all privacy use cases have been solved, the last few years have seen great strides in privacy-preserving technologies.</p>","To get the most out of your experience in this course, we recommend the following:,No background in cryptography or advanced mathematics is required.,See the , for using Udacity.",Deep learning is driving advances in artificial intelligence that are changing our world. Enroll now to build and apply your own deep neural networks to produce amazing solutions to important challenges.,Andrew Trask,,,,,,"<?xml version=""1.0""?><mainmodule><module1><heading>Differential Privacy</heading><subheading><item1>Learn the mathematical definition of privacy</item1><item2>Train on data that is highly distributed across multiple organizations and data centers using PyTorch and PySyft</item2><item3>Do arithmetic on encrypted numbers</item3></subheading></module1><module2><heading>Federated Learning</heading><subheading><item1>Train AI models in PyTorch to learn public information from within private datasets</item1><item2>Aggregate gradients using a ""trusted aggregator""</item2><item3>Use cryptography to share ownership over a number using Secret Sharing</item3></subheading></module2><module3><heading>Encrypted Computation</heading><subheading></subheading></module3></mainmodule>",Free,,
<200 https://www.udacity.com/course/intel-edge-AI-fundamentals-with-openvino--ud132>,Intel® Edge AI Fundamentals with OpenVINO™,<p>Stay at the cutting-edge of AI technology by gaining practical skills for deploying edge AI. Learn how to use the Intel® Distribution of the OpenVINO™ toolkit to deploy computer vision capabilities inside a range of edge applications. Leverage the potential of edge computing and use the Intel® Distribution of the OpenVINO™ toolkit to fast-track development of high-performance computer vision and deep learning inference applications.</p>,"Basic Python experience. Basic familiarity with computer vision and AI model creation.,See the , for using Udacity.",Lead the development of cutting-edge Edge AI applications that are the future of the Internet of Things. Leverage the Intel® Distribution of OpenVINO™ Toolkit to fast-track development of high-performance computer vision and deep learning inference applications.,Michael Virgo,,,,,,"<?xml version=""1.0""?><mainmodule><module1><heading>Leveraging Pre-Trained Models</heading><subheading><item1>Leverage a pre-trained model for computer vision inferencing</item1><item2>Convert pre-trained models into the framework-agnostic intermediate representation with the Model Optimizer</item2><item3>Perform efficient inference on deep learning models through the hardware-agnostic Inference Engine</item3><item4>Deploy an app on the edge, including sending information through MQTT, and analyze model performance and use cases</item4></subheading></module1><module2><heading>The Model Optimizer</heading><subheading></subheading></module2><module3><heading>The Inference Engine</heading><subheading></subheading></module3><module4><heading>Deploying an Edge App</heading><subheading></subheading></module4></mainmodule>",Free,,
<200 https://www.udacity.com/course/machine-learning-for-trading--ud501>,Machine Learning for Trading,"<p>This course introduces students to the real world challenges of implementing machine learning based trading strategies including the algorithmic steps from information gathering to market orders. The focus is on how to apply probabilistic machine learning approaches to trading decisions. We consider statistical approaches like linear regression, KNN and regression trees and how to apply them to actual stock trading situations.</p>","Students should have strong coding skills and some familiarity with equity markets. No finance or machine learning experience is assumed.,Note that this course serves students focusing on computer science, as well as students in other majors such as industrial systems engineering, management, or math who have different experiences. All types of students are welcome!,The ML topics might be ""review"" for CS students, while finance parts will be review for finance students. However, even if you have experience in these topics, you will find that we consider them in a different way than you might have seen before, in particular with an eye towards implementation for trading.,Programming will primarily be in Python. We will make heavy use of numerical computing libraries like NumPy and Pandas.,See the , for using Udacity.","Complete real-world projects designed by industry experts, covering topics from asset management to trading signal generation. Master AI algorithms for trading, and build your career-ready portfolio.",Tucker Balch| Arpan Chakraborty,,,,,,"<?xml version=""1.0""?><mainmodule><module1><heading>Manipulating Financial Data in Python</heading><subheading></subheading></module1><module2><heading>Computational Investing</heading><subheading></subheading></module2><module3><heading>Machine Learning Algorithms for Trading</heading><subheading></subheading></module3></mainmodule>",Free,,
<200 https://www.udacity.com/course/big-data-analytics-in-healthcare--ud758>,Big Data Analytics in Healthcare,"<p>Data science plays an important role in many industries. In facing massive amount of heterogeneous data, scalable machine learning and data mining algorithms and systems become extremely important for data scientists. The growth of volume, complexity and speed in data drives the need for scalable data analytic algorithms and systems. In this course, we study such algorithms and systems in the context of healthcare applications.</p>","Basic machine learning and data mining concepts such as classification and clustering;,Proficient programming and system skills in Python, Java and Scala;,Proficient knowledge and experience in dealing with data (recommended skills include SQL, NoSQL such as MongoDB).,See the , for using Udacity.","Master job-ready autonomous flight software engineering skills as you tackle advanced challenges, write real code for real aircraft, and develop a systems understanding of the Flying Car full-stack.",Jimeng Sun| David Joyner,,,,,,"<?xml version=""1.0""?><mainmodule><module1><heading>Big Data</heading><subheading><item1>Predictive Modeling</item1><item2>Computational Phenotyping</item2><item3>MapReduce</item3></subheading></module1><module2><heading>Healthcare</heading><subheading><item1>Dimensionality Reduction & Tensor Factorization</item1><item2>Patient Similarity Metrics</item2><item3>Spark</item3></subheading></module2><module3><heading>Technologies</heading><subheading><item1>Graph Analysis</item1><item2>Medical Ontology</item2><item3>Hadoop</item3></subheading></module3></mainmodule>",Free,,
<200 https://www.udacity.com/course/artificial-intelligence--ud954>,Artificial Intelligence,"<p>Learn about the fundamentals of Artificial Intelligence in this introductory graduate-level course. It provides a survey of various topics in the field along with in-depth discussion of foundational concepts such as classical search, probability, machine learning, logic and planning.</p>","Undergraduate computer algorithm and data structures courses that cover O notation, time and space constraints; working knowledge of college level mathematics such as calculus, probability, and linear algebra. You will also need to be familiar with Python and be comfortable making modifications to large programs.,Please review the following questions, if you answer ""no"" to any of them you may want to refresh your knowledge or practice the required skills prior to taking the class:  ,See the , for using Udacity.","Learn essential Artificial Intelligence concepts from AI experts like Peter Norvig and Sebastian Thrun, including search, optimization, planning, pattern recognition, and more.",Thad Starner,,,,,,"<?xml version=""1.0""?><mainmodule><module1><heading>Search</heading><subheading><item1>Game Playing</item1><item2>Constraint Satisfaction</item2><item3>Simulated Annealing</item3></subheading></module1><module2><heading>Constraints and Bayes Nets</heading><subheading><item1>Basics of Search</item1><item2>Probability</item2><item3>Machine Learning</item3></subheading></module2><module3><heading>Basics of Machine Learning</heading><subheading><item1>Logic and Planning</item1><item2>Bayes Nets</item2><item3>Pattern Recognition through Time</item3></subheading></module3></mainmodule>",Free,,
