title,description,short_description,total_duration,total_duration_unit,regular_price,sale_price,currency,batch_date,batch_timing,batch_days,batch_price,what_will_learn,instructor_image,instructor_name,instructor_designation,reviewer_review,reviewer_name,faq_question,faq_answers,reviewer_image,instructor_description,emi_installment_time,emi_installment,target_students,prerequisites,heading,total_video_content,instruction_type,cover_image
Become a CertifiedSocial Media Marketing Expert,<p>Course HighlightsSuccessful completion of our Professional Certificate in Social Media Marketing Course with the assignments will take your community-building skills to next level.Enroll Now</p>,Course HighlightsSuccessful completion of our Professional Certificate in Social Media Marketing Course with the assignments will take your community-building skills to next level.Enroll Now,8 , Hours ,"30,000","25,000",INR,,,,,"Gain a strong fundamental understanding of digital marketing with a focus on building an online presence for individuals and brands in the industry.|Be well-versed with all key elements of social media marketing|Learn how to create content and build an effective content plan for social media marketing platforms|Craft a strategy to drive brand awareness for brands, through social media marketing|Leverage various Social Media Marketing platforms to manage the crisis, get followers and build a community",,,,,,,,,,,,,,"<p><strong>Module 1: </strong>Introduction (0.5 learning hours)</p><p><strong>Module 2: </strong>How to become an influencer (4 learning hours)</p><p><strong>Module 3: </strong>Content creation (2 learning hours)</p><p><strong>Module 4: </strong>Content planning (2 learning hours)</p><p><strong>Module 5: </strong>Community management (3 learning hours)</p><p><strong>Module 6: </strong>Chatbots (0.5 learning hours)</p><p><strong>Module 7: </strong>Social media dark arts (0.5 learning hours)</p><p><strong>Module 8: </strong>Facebook business manager (1 learning hours)</p><p><strong>Module 9: </strong>Social media ads creation process (4 learning hours)</p><p><strong>Module 10: </strong>Boost post and Instagram Ads (0.5 learning hours)</p><p><strong>Module 11: </strong>Social media monitoring (1 learning hours)</p><p><strong>Module 12: </strong>Social media planning (5 learning hours)</p><p><strong>Module 13: </strong>Digital Sports Marketing (5 learning hours)</p><p><strong>Module 14: </strong>Introduction to the Course</p><p><strong>Module 15: </strong>Landscape of Digital Marketing</p><p><strong>Module 16: </strong>Profile Optimization</p><p><strong>Module 17: </strong>Content Planning</p><p><strong>Module 18: </strong>Content Creation</p><p><strong>Module 19: </strong>Chatbots</p><p><strong>Module 20: </strong>Social Media Dark Arts</p><p><strong>Module 21: </strong>Facebook Business Manager</p><p><strong>Module 22: </strong>Social Media Ads Creation Process (Facebook, LinkedIn, Twitter)</p><p><strong>Module 23: </strong>Boost Post and Instagram Ads</p><p><strong>Module 24: </strong>Social Media Monitoring</p><p><strong>Module 25: </strong>Social Media Planning</p><p><strong>Module 26: </strong>Digital Sports Marketing - The Rajasthan Royals Way</p>",30+ ,Self Paced,"data:image/svg+xml,%3Csvg%20xmlns='http://www.w3.org/2000/svg'%20viewBox='0%200%20162%2051'%3E%3C/svg%3E"
EMAIL MARKETING COURSE,"<p>In this Email Marketing course, there will be a project of 1 month & few take home assignments to give hands-on experience of Email Marketing.Email MarketingOn registration, you will receive participation details for 1 month live instructor-led online Email Marketing course sessions. You can attend these sessions from anywhere.Saturday or Sunday (Weekend Batch) / Tues & Thur (Weekday Batch)1000 AM to 130 PM (IST) / 800 PM to 930 PM (IST)Online [You could be living anywhere in India (e.g. Delhi, Gurgaon, Bangalore, Mumbai, Chennai, Hyderabad, Noida, Pune) or outside India (e.g. Singapore, Malaysia, UAE/Dubai)]60% attendance mandatoryOnce you complete 1 month Email Marketing training program, you will become eligible to appear in the CEMM Exam at your preferred testing center. Following are the exam details</p>","In this Email Marketing course, there will be a project of 1 month & few take home assignments to give hands-on experience of Email Marketing.Email MarketingOn registration, you will receive participation details for 1 month live instructor-led online Email Marketing course sessions",12,Hours," 11,900",,INR,"August 30 – September 22, 2022",08:00 PM - 9:30 PM ,Weekday,"Rs 11,900/-*",Why Email Marketing?|Email Marketing Vs Other Marketing Platforms|Case Study Analysis|Email Marketing Platform Setup|Understanding IP/DNS|Shared Vs Dedicated IP|Whitelisting|Response Handlers|Hard Bounce Vs Soft Bounce|Content Relevancy|Incentivising Audience|Limited Info Strategy|Do’s & Don’ts for Email Content|Best Practices for Email Templates|Creative Selection|NLP Demonstrations to Understand Customer Behavior|Rented List Emails|Co-branded Emails|Newsletters|Viral Emails|Event Triggered Emails|Tools to Enhance Lead Nurturing|Analyze Behavior Patterns|Automated Emails|Setup Drip Emails|Email Report Analysis, https://www.digitalvidya.com/wp-content/uploads/2019/09/Priyash-220x220.jpg | https://www.digitalvidya.com/wp-content/uploads/2020/09/avatar.jpg | https://www.digitalvidya.com/wp-content/uploads/2020/09/avatar.jpg |  https://www.digitalvidya.com/wp-content/uploads/2013/09/kapil-nakra-220x143.jpg | https://www.digitalvidya.com/wp-content/uploads/2013/09/pradeep-chopra.png,Priyash Nigam|Gurpreet Singh|Rahul Bhowmick|Kapil Nakra|Pradeep Chopra,Co-Founder at Digital Vidya|Co-Founder at Digital Vidya,“B2C Marketers report an average of 256% ROI from this channel – pulling in $2.56 for every $1 invested..” | CDMM Course has very detail modules and the instructors are also very knowledgeable in the subject areas. | I had nice experience in DIgital Marketing Course. It has good content coverage and I got good support from DV team  . | This course not only teaches the Digital Marketing Skills but covers the basic principles of marketing & Customer behaviour. | The course was amazing and way interactive. All the trainers were amazing. Digital Vidya is precisely the first and last stop for learning Digital Marketing. | I have done and learnt things which were eye openers for me and I am sure it would help me in future. Thanks a lot Team Digital Vidya.,Marketing Sherpa|Edward Dzoboku|SAIKAT PRADHAN|Chandramohan S|Shubham Gupta|Abhinay Patil|Sudharshan,Who will award these certifications?|What will happen if I miss any live session?|Who is Vskills?|Why did you choose online medium for delivery?,"Digital Vidya will offer Certification on Email Marketing certification programs.|We understand that. We will provide you recording of every session of CEMM course for you to continue to learn Email Marketing Techniques.|Vskills is a “skills testing” and certification exam conducted by – ICSIL, A Govt. of India Undertaking and Govt.of NCT Delhi Company. It is one of the largest manpower companies of the Government of NCT Delhi. Vskills certifications help candidates quantify and prove their skills in a particular domain – skills that are valued by the employer and are in great demand.|There are a number of reasons for it. We’ve been successfully organizing instructor-led, online courses since more than 11 years. In addition to helping you save precious time & money, instructor-led online format offers far better learning as we are able to provide you separate Industry Expert as Lead Trainer for each of the training modules. Online medium allows far deeper and regular interaction among participants and lead trainers throughout the course duration. It also significantly reduces your chance of missing a session as you will be able to attend the session from any place.",,,,,"SALES & MARKETING PROFESSIONALS|ENTREPRENEURS/BUSINESS OWNERS|DIGITAL MARKETING PROFESSIONALS|STUDENTS (BBA, MBA, B.E, COMMERCE…)|OTHER PROFESSIONALS (IT, HR..)",,<p><strong>Module 1: </strong>INTRODUCTION</p><p><strong>Module 2: </strong>SETUP & DELIVERY</p><p><strong>Module 3: </strong>EFFECTIVE EMAIL CONTENT</p><p><strong>Module 4: </strong>EFFECTIVE EMAIL TEMPLATE</p><p><strong>Module 5: </strong>CUSTOMER ACQUISITION STRATEGIES</p><p><strong>Module 6: </strong>NURTURING & AUTOMATION</p>,,Instructor Paced,"data:image/svg+xml,%3Csvg%20xmlns='http://www.w3.org/2000/svg'%20viewBox='0%200%20162%2051'%3E%3C/svg%3E"
INBOUND MARKETING CERTIFICATION COURSE TRAINING ONLINE,"<p>In this Inbound Marketing Course, there will be a project of 1 month & few take home assignments to give hands-on experience of Inbound Marketing.Inbound MarketingOn registration, you will receive participation details for 1 month live instructor-led online Inbound Marketing course sessions. You can attend these sessions from anywhere.Saturday or Sunday (Weekend Batch) / Tues & Thur (Weekday Batch)1000 AM to 130 PM (IST) / 800 PM to 930 PM (IST)Online [You could be living anywhere in India (e.g. Delhi, Gurgaon, Bangalore, Mumbai, Chennai, Hyderabad, Noida, Pune) or outside India (e.g. Singapore, Malaysia, UAE/Dubai)]60% attendance mandatoryOnce you complete 1 month inbound marketing course, you will become eligible to appear in the CIMM Exam at your preferred testing center. Following are the exam details</p>","In this Inbound Marketing Course, there will be a project of 1 month & few take home assignments to give hands-on experience of Inbound Marketing.Inbound MarketingOn registration, you will receive participation details for 1 month live instructor-led online Inbound Marketing course sessions",12,Hours,,,INR,,,,,Understanding Conversion Funnel|Methods to build reach through Digital Marketing|What are Engagement Magnets?|Identifying the right set of engagement magnets for your business|Inbound Interest Generation Strategy|Reach Out to Potential Customers using Emails|Life Cycle Emails|Lead Nurturing with Drip Emails|Web Page Vs Landing Page|Conversion Oriented Landing Page|Best Practices for Creating Effective Landing Pages|Understanding Customer Psyche|User Flow & Persuasion|User Journey from Prospect to Lifetime Customer|Conversion Optimization Patterns for Engaging Website Visitors, https://www.digitalvidya.com/wp-content/uploads/2016/11/11-1.jpg | https://www.digitalvidya.com/wp-content/uploads/2013/09/pradeep-chopra.png,Praful Jain|Pradeep Chopra,Team Leader with Cognizant for their Google AdWords and Analytics team|Co-Founder at Digital Vidya,“Marketers need to build digital relationships and reputation before closing a sale.” | CDMM Course has very detail modules and the instructors are also very knowledgeable in the subject areas. | I had nice experience in DIgital Marketing Course. It has good content coverage and I got good support from DV team  . | This course not only teaches the Digital Marketing Skills but covers the basic principles of marketing & Customer behaviour. | The course was amazing and way interactive. All the trainers were amazing. Digital Vidya is precisely the first and last stop for learning Digital Marketing. | I have done and learnt things which were eye openers for me and I am sure it would help me in future. Thanks a lot Team Digital Vidya.,"Chris Brogan, Publisher, Owner Magazine ( http://ownermag.com )|Edward Dzoboku|SAIKAT PRADHAN|Chandramohan S|Shubham Gupta|Abhinay Patil|Sudharshan",Who will award these Inbound Marketing certifications?|What will happen if I miss any live session?|Who is Vskills?|Why did you choose online medium for delivery?,"Digital Vidya will offer Certification on Inbound Marketing certifications.|We understand that. We will provide you the recording of every session of CIMM course.|Vskills is a “skills testing” and certification exam conducted by – ICSIL, A Govt. of India Undertaking and Govt.of NCT Delhi Company. It is one of the largest manpower companies of the Government of NCT Delhi. Vskills certifications help candidates quantify and prove their skills in a particular domain – skills that are valued by the employer and are in great demand.|There are a number of reasons for it. We’ve been successfully organizing instructor-led, online courses since more than 11 years. In addition to helping you save precious time & money, instructor-led online format offers far better learning as we are able to provide you separate Industry Expert as Lead Trainer for each of the training modules. Online medium allows far deeper and regular interaction among participants and lead trainers throughout the course duration. It also significantly reduces your chance of missing a session as you will be able to attend the session from any place.",,,,,"SALES & MARKETING PROFESSIONALS|ENTREPRENEURS/BUSINESS OWNERS|DIGITAL MARKETING PROFESSIONALS|STUDENTS (BBA, MBA, B.E, COMMERCE…)|OTHER PROFESSIONALS (IT, HR..)",,<p><strong>Module 1: </strong>ATTRACT POTENTIAL CUSTOMERS:</p><p><strong>Module 2: </strong>CONVERT PROSPECTS INTO LEADS:</p><p><strong>Module 3: </strong>LANDING PAGE OPTIMIZATION:</p><p><strong>Module 4: </strong>CONVERSION OPTIMIZATION:</p>,,Instructor Paced,"data:image/svg+xml,%3Csvg%20xmlns='http://www.w3.org/2000/svg'%20viewBox='0%200%20162%2051'%3E%3C/svg%3E"
SEARCH ENGINE MARKETING (SEM) ONLINE TRAINING COURSE,"<p>In this Search Engine Marketing Training, there will be a project of 1 month & few take home assignments to give hands-on experience of Search Engine Marketing.On registration, you will receive participation details for 1 month live instructor-led online Search Engine Marketing (SEM) course sessions. You can attend these sessions from anywhere.Saturday or Sunday (Weekend Batch) / Tues & Thur (Weekday Batch)1000 AM to 130 PM (IST) / 800 PM to 930 PM (IST)Online [You could be living anywhere in India (e.g. Delhi, Gurgaon, Bangalore, Mumbai, Chennai, Hyderabad, Noida, Pune) or outside India (e.g. Singapore, Malaysia, UAE/Dubai)]80% attendance mandatoryOnce you complete 1 month SEM Training Program, you will have to appear for an online exam to attain the certificate. Following are the exam detailsSearch Engine Marketing (SEM) is a cost effective way of generating highly relevant leads for your business. The best thing about SEM is that it offers contextual targeting, which helps you to target audience based on their interests, location, demographics, time and so on. SEM campaign is based on CPC (Cost-per-click) advertisement model. You only need to pay when a user clicks on your ad. Also unlike SEO, it starts immediately and you will start getting results as soon as you start the campaign.</p>","In this Search Engine Marketing Training, there will be a project of 1 month & few take home assignments to give hands-on experience of Search Engine Marketing.On registration, you will receive participation details for 1 month live instructor-led online Search Engine Marketing (SEM) course sessions",12,Hours," 11,900",,INR,"October 1 – October 29, 2022",10:00 am – 1:30 pm ,Saturday,"Rs 11,900/-*",Understanding Consumer Journey|SERP Overview|Introduction to Google Ads|Google Search Network (GSN)|Google Display Network (GDN)|Campaign Types and Objectives|Keyword Research & Planning|Understanding Match Types|Campaign Creation|Introduction to Google Display Network (GDN)|Dynamic Ad Creation|Video Ads|Shopping PLA Campaigns|Mobile Ads|Conversion Tracking|Define Performance Metrics|Understanding Quality Score|Bid Management|Monitor PPC activity with Google Analytics|Understanding Customer Behavior|Creating Custom Audience|Remarketing Ads & Best Practices, https://www.digitalvidya.com/wp-content/uploads/2013/09/kapil-nakra-220x143.jpg | https://www.digitalvidya.com/wp-content/uploads/2013/09/pradeep-chopra.png,Ruchi Sinha|Tanmoy Das|Kapil Nakra|Pradeep Chopra,"Digital Consultant and SEM Expert|AdWords Team Manager, Cognizant|Co-Founder at Digital Vidya|Co-Founder at Digital Vidya","“Search Engine Marketing (SEM) and Search Engine Optimization (SEO) are critically important to online businesses. You can spend every penny you have on a website, but it will all be for nothing if nobody knows your site is there.” | CDMM Course has very detail modules and the instructors are also very knowledgeable in the subject areas. | I had nice experience in DIgital Marketing Course. It has good content coverage and I got good support from DV team  . | This course not only teaches the Digital Marketing Skills but covers the basic principles of marketing & Customer behaviour. | The course was amazing and way interactive. All the trainers were amazing. Digital Vidya is precisely the first and last stop for learning Digital Marketing. | I have done and learnt things which were eye openers for me and I am sure it would help me in future. Thanks a lot Team Digital Vidya.",Marc Ostrofsky|Edward Dzoboku|SAIKAT PRADHAN|Chandramohan S|Shubham Gupta|Abhinay Patil|Sudharshan,Who will award these certifications?|Why did you choose online medium for delivery?|What will happen if I miss any live session?,"Digital Vidya will offer Certification in Search Engine Marketing. You can also apply for Vskills Exam and Google Ads Certifications like Google Ads Search, Google Ads App, Google Ads Display, Google Ads Video, and Google Ads Measurement Certifications.|We understand that. We will provide you with the recording of every session of the SEM Course.",,,,,"SALES & MARKETING PROFESSIONALS|ENTREPRENEURS/BUSINESS OWNERS|DIGITAL MARKETING PROFESSIONALS|STUDENTS (BBA, MBA, B.E, COMMERCE…)|OTHER PROFESSIONALS (IT, HR..)",,<p><strong>Module 1: </strong>Overview on Search Engine Marketing</p><p><strong>Module 2: </strong>SEARCH CAMPAIGNS (PPC)</p><p><strong>Module 3: </strong>GOOGLE DISPLAY NETWORK</p><p><strong>Module 4: </strong>SHOPPING & MOBILE ONLY ADS</p><p><strong>Module 5: </strong>CAMPAIGN OPTIMISATION & PERFORMANCE TRACKING</p><p><strong>Module 6: </strong>CUSTOM AUDIENCE & REMARKETING</p>,,Instructor Paced,"data:image/svg+xml,%3Csvg%20xmlns='http://www.w3.org/2000/svg'%20viewBox='0%200%20162%2051'%3E%3C/svg%3E"
