title,description,short_description,total_duration,total_duration_unit,regular_price,sale_price,currency,batch_date,batch_timing,batch_days,batch_price,what_will_learn,instructor_image,instructor_name,instructor_designation,reviewer_review,reviewer_name,faq_question,faq_answers,reviewer_image,instructor_description,emi_installment_time,emi_installment,target_students,prerequisites,heading,total_video_content,instruction_type,cover_image
SEO ONLINE TRAINING COURSE,"<p>In this SEO course, there will be a project of 1 month & few take home assignments to give hands-on experience of Search Engine Optimization.SEOOn registration, you will receive participation details for 1 month live instructor-led online Search Engine Optimization (SEO) course sessions. You can attend these sessions from anywhere.Saturday or Sunday (Weekend Batch) / Tues & Thur (Weekday Batch)1000 AM to 130 PM (IST) / 800 PM to 930 PM (IST)Online [You could be living anywhere in India (e.g. Delhi, Gurgaon, Bangalore, Mumbai, Chennai, Hyderabad, Noida, Pune) or outside India (e.g. Singapore, Malaysia, UAE/Dubai)]80% attendance mandatoryOnce you complete 1 month SEO Training Program, you will have to appear for an online exam toattain the certificate. Following are the exam details</p>","In this SEO course, there will be a project of 1 month & few take home assignments to give hands-on experience of Search Engine Optimization.SEOOn registration, you will receive participation details for 1 month live instructor-led online Search Engine Optimization (SEO) course sessions",12,Hours,"11,900",,INR,"20 Sep - 13 Oct, 2022|08:00 PM to 9:30 PM (IST)|Tuesday|24 Sep - 15 Oct, 2022|10:00 AM to 1:30 PM (IST)|Saturday",08:00 PM - 9:30 PM |10:00 AM - 1:30 PM ,Tuesday | Saturday,"₹ 11,900/-*|₹ 11,900/-*",Understanding Search Engines|-Crawling | Indexing | Ranking|Keyword Research|Preliminary Research|Gather Metrics|Keyword Mapping|Understanding Website Buildup|OnPage SEO|Understanding Sitemaps & Robots.txt files|Site Speed Optimisation|Off Page SEO|Link Building Tactics|Understanding SEO Metrics|Website SEO Audit|Competitor Analysis|, https://www.digitalvidya.com/wp-content/uploads/2016/02/1-3.jpg |  https://www.digitalvidya.com/wp-content/uploads/2013/09/kapil-nakra-220x143.jpg,Divya Jain|Hiren Joshi|Mandar Marathe|Kapil Nakra,Head of SEO at Pick Your Trail | 12+ Years of Experience|Founder at Bee Online Communications | 9+ Years of Exp|Co-Founder BriefKase Digital Communications|Co-Founder at Digital Vidya,"“As long as you have great content you should do well on Google, but you know if people are spamming or you hire a bad SEO, that can lead to unpredictable results.” | CDMM Course has very detail modules and the instructors are also very knowledgeable in the subject areas. | I had nice experience in DIgital Marketing Course. It has good content coverage and I got good support from DV team  . | This course not only teaches the Digital Marketing Skills but covers the basic principles of marketing & Customer behaviour. | The course was amazing and way interactive. All the trainers were amazing. Digital Vidya is precisely the first and last stop for learning Digital Marketing. | I have done and learnt things which were eye openers for me and I am sure it would help me in future. Thanks a lot Team Digital Vidya.","Matt Cutts, Google|Edward Dzoboku|SAIKAT PRADHAN|Chandramohan S|Shubham Gupta|Abhinay Patil|Sudharshan",Who will award these SEO certifications?|What will happen if I miss any live session?|Who is Vskills?|Why did you choose online medium for delivery?,"Digital Vidya will offer Certification on SEO (Search Engine Optimization).|We understand that. We will provide you recording of every session of CSEOM course for you to continue to learn SEO Techniques.|Vskills is a “skills testing” and certification exam conducted by – ICSIL, A Govt. of India Undertaking and Govt.of NCT Delhi Company. It is one of the largest manpower companies of the Government of NCT Delhi. Vskills certifications help candidates quantify and prove their skills in a particular domain – skills that are valued by the employer and are in great demand.|There are a number of reasons for it. We’ve been successfully organizing instructor-led, online courses since more than 11 years. In addition to helping you save precious time & money, instructor-led online format offers far better learning as we are able to provide you separate Industry Expert as Lead Trainer for each of the training modules. Online medium allows far deeper and regular interaction among participants and lead trainers throughout the course duration. It also significantly reduces your chance of missing a session as you will be able to attend the session from any place.",,,,,"SALES & MARKETING PROFESSIONALS|ENTREPRENEURS/BUSINESS OWNERS|DIGITAL MARKETING PROFESSIONALS|STUDENTS (BBA, MBA, B.E, COMMERCE…)|OTHER PROFESSIONALS (IT, HR..)",,<p><strong>Module 1: </strong>Introduction to SEO</p><p><strong>Module 2: </strong>On-Page SEO</p><p><strong>Module 3: </strong>Off-Page SEO</p><p><strong>Module 4: </strong>SEO Audit</p>,,Instructor Paced,"data:image/svg+xml,%3Csvg%20xmlns='http://www.w3.org/2000/svg'%20viewBox='0%200%20162%2051'%3E%3C/svg%3E"
Build your online store and work towards your first,"<p>Self-Paced Learning Program to give users the flexibility of learning at their own pace. This course is designed for people who are looking for a step by step explained method to successfully create their first online business, or for existing business owners who wish to have a website to sell their products or services online without a large initial investment.</p>",Self-Paced Learning Program to give users the flexibility of learning at their own pace,10  , Hours ,9900,,INR,,,,,,,,,,,,,,,,,,,,,Self Paced,"data:image/gif;base64,R0lGODlhAQABAIAAAAAAAP///yH5BAEAAAAALAAAAAABAAEAAAIBRAA7"
Certified Facebook Marketing Course,"<p>More than 1.8 billion people use Facebook to connect with people and discover things. Millions of businesses are using Facebook each day to drive discovery, generate leads, boost sales and earn loyalty to stay on top of customer’s mind.</p>",More than 1.8 billion people use Facebook to connect with people and discover things,,,11900 ,,INR,"Dec 10 – Dec 17, 2021",,,,Find new customers|Increase your sales|Generate demand for your product|Generate leads for your business|Build relationships to keep your business on top of user’s mind,,Rohit Uttamchandani|Pranav kale|Samvidha Sinha|Mandar Marathe,,,, Who will award the certification?| Why did you choose flipped method for delivery?| What will happen if I miss any live session?| Will I be able to clear Facebook Blueprint certification?,"Digital Vidya and Facebook will jointly offer the certification||While pre-recorded sessions help the participants control the session. They can watch, rewind, and fast-forward as needed. Sessions that can be viewed more than once. Devoting class time to application of concepts gives the trainer a better opportunity to discuss real business cases and group projects, thus encouraging participants to learn from each other.|We understand that. We will share the recording of each session, whether you attend it or not :).|Yes, our course will enable you to do that. You can appear and clear all 3 Blueprint Certifications post completion of the course.",,"Rohit Uttamchandani is Senior Manager – Digital Marketing at Social Beat, one of South India’s leading digital marketing agencies.|Although an engineer by profession, Pranav decided to embrace the one field which excites him the most – Social Media Marketing!|Samvidha has over 8 years of experience in Digital Marketing. She is a MICa alumni and believes to be a forever student of Advertising|Mandar, having an experience of around 8 years of experience in Digital Marketing at BriefKase, a full-service digital marketing agency for startups &amp; small businesses",,,,,<p><strong>Module 1: </strong>Learn How to create a Facebook business manager</p><p><strong>Module 2: </strong>Learn to set up Ads on Facebook and understand different Facebook campaign objectives</p><p><strong>Module 3: </strong>Learn to set up Facebook ads with the best performing structure and avoid ad saturation.</p><p><strong>Module 4: </strong>Learn how Facebook machine learning algorithm works to better optimize your Facebook campaigns</p><p><strong>Module 5: </strong>Learn how to set up pixel on the website to track data</p><p><strong>Module 6: </strong>Learn to create specific website events to track and optimize campaigns and conversions</p><p><strong>Module 7: </strong>Understand how to create remarketing audiences using custom audience option</p><p><strong>Module 8: </strong>Learn to create lookalike audience to reduce ad cost and get more conversions</p><p><strong>Module 9: </strong>Learn how an ecommerce business can grow using Facebook ads.</p><p><strong>Module 10: </strong>Learn to create a Facebook catalogue to run individual product ads</p><p><strong>Module 11: </strong>Learn how to create break down reports of existing campaigns and interpret the data to optimize campaigns and reach.</p><p><strong>Module 12: </strong>Understand the best practices to make use of Facebook Business suite and to run advertisements with good performance</p>,,Self Paced,"data:image/svg+xml,%3Csvg%20xmlns='http://www.w3.org/2000/svg'%20viewBox='0%200%20162%2051'%3E%3C/svg%3E"
Digital Marketing Leadership Program,"<p>Digital marketing has become omnipresent nowadays. Whether you want to ensure your career growth or optimize your business presence, mastering digital marketing skills is important. In fact, the pandemic has made Digital Marketing a must-have life skill.The Digital Marketing Leadership Program (Online) is designed to help you develop a deep understanding of your consumers and the various digital channels available to reach them.</p>",Digital marketing has become omnipresent nowadays,4  ,Months,"90,000",,INR,,,,,"Master the essentials of digital marketing channels and their nuances.|Explore online ads, search, and social media and implement through personalized online presence.|Unleash the power of email marketing and its relevance.|Deep dive into the world of content marketing, its impact and ROI.|Promote advocacy across social media networks.|Hands-on experience on digital marketing tools and structures you can use to implement and measure the outcomes of your digital marketing campaigns.|Explore the impact of key trends in the digital marketing industry, including web analytics and automation.|Learn to design an apt digital marketing strategy by accurate. consumer profiling and targeting|Prepare for the future of digital marketing through specialized sessions.",https://d9hhrg4mnvzow.cloudfront.net/course.digitalvidya.com/executive-program-digital-marketing/ef9a2b42-zain-siddiqui-150x150_1000000000000000000028.png | https://d9hhrg4mnvzow.cloudfront.net/course.digitalvidya.com/executive-program-digital-marketing/69cb5869-shawn-powrie-150x150_1000000000000000000028.png | https://d9hhrg4mnvzow.cloudfront.net/course.digitalvidya.com/executive-program-digital-marketing/c157bbab-rajeev-sharma-150x150_1000000000000000000028.png | https://d9hhrg4mnvzow.cloudfront.net/course.digitalvidya.com/executive-program-digital-marketing/1e36f409-praful-jain-150x150_1000000000000000000028.png | https://d9hhrg4mnvzow.cloudfront.net/course.digitalvidya.com/executive-program-digital-marketing/f74dd0f0-samvidha-sinha-150x150_1000000000000000000028.png | https://d9hhrg4mnvzow.cloudfront.net/course.digitalvidya.com/executive-program-digital-marketing/d723d6dc-shweta-dhadiwal-150x150_1000000000000000000028.png | https://d9hhrg4mnvzow.cloudfront.net/course.digitalvidya.com/executive-program-digital-marketing/37879f24-raj-singh-150x150_1000000000000000000028.png | https://d9hhrg4mnvzow.cloudfront.net/course.digitalvidya.com/executive-program-digital-marketing/7d2d923b-hiren-joshi-150x150_1000000000000000000028.png | https://d9hhrg4mnvzow.cloudfront.net/course.digitalvidya.com/executive-program-digital-marketing/96b304cc-chandan-singh-150x150_1000000000000000000028.png | https://d9hhrg4mnvzow.cloudfront.net/course.digitalvidya.com/executive-program-digital-marketing/36968bf9-priyash-nigam-150x150_1000000000000000000028.png,Zain|Shawn Powrie|Rajeev Sharma|Praful Jain|Samvidha Sinha|Shweta Dhadiwal|Raj Singh|Hiren Joshi|Chandan Singh|Priyansh Nigam,,I had nice experience in DIgital Marketing Course. It has good content coverage and I got good support from DV team | The course was amazing and way interactive. All the trainers were amazing. Digital Vidya is precisely the first and last stop for learning Digital Marketing. | I have done and learnt things which were eye openers for me and I am sure it would help me in future. Thanks a lot Team Digital Vidya. | I enjoyed learning a lot of new things in Digital Marketing. Thanks to all my Trainers & Digital Vidya’s team.,Saikat Pradhan|Shubham Gupta|Sudharshan|Abhinay Patil,Who is this program for?|Is there a minimum qualification for this program?|What kind of certification will I get after course completion?|How much time do I need to spend to achieve success in this course?|Can I do the program from any city?|How do I know the program curriculum is the best?|What kind of support will I get?|Is there a minimum qualification for this program?|Are there EMI options available for this programme?|Will I be charged extra for EMI options?|Are there any Loan options available?|Is there a refund policy for this programme?,"| Deakin University Digital Marketing Leadership program is designed for the following:|CXO's and Senior Leaders who want to expand their Digital Marketing learning and gain hands-on experience with the latest tools and techniques. They may want to manage Digital Marketing efforts in their organizations or learn how to improve customer experience.|Working Professionals seeking to move into a career in Digital Marketing and get their hands dirty with the latest trends and tools.|| It is expected that the learner has attended a graduation program and must meet Deakin’s English speaking requirement criteria.||| Successful completion of the program will award you a wall of certificates. It comes with an Digital Marketing Leadership Program Certificate from Deakin University, ranked 1% worldwide and a completion certificate from Digital Vidya. In addition, there are exclusive certificates from Facebook and LinkedIn. In the program, you will also become eligible for external certifications from Google and Hubspot.|| You will need to spend approximately 10-12 hours per week to successfully complete your learning journey. The program comes with live interaction sessions, quizzes, case studies, assignments and evaluation|| Yes, the program can be done from anywhere in the world|| The program is co-developed and co-delivered by International faculty members from Deakin University and leading industry practitioners. The program focuses on providing marketing leadership with practical hands-on knowledge to make professional jobs ready.|||Our dedicated support team is available from 9am to 6pm on all working days to resolve any non-academic queries.|Each learner will get access to a Learning Management System (LMS) which has a Q&A support desk amongst other features like lifetime access to updated content and industry webinars. The Learners can post their query on this forum and a team of Training Assistants or Trainer will respond with 24 hours. The LMS allows for peer-to-peer learning which enriches the learning experience.|| It is expected that the learner has attended a marketing program and must meet Deakin’s English requirement criteria.||| Yes, there are EMI options available through our financing partners.|| The 6-month EMI option is interest free and there are no extra charges for the learner. For a higher duration EMI, there is a processing fee charged.|| Yes, You can avail Education Loan from our Partners with Interest Free EMI for 6 Months,if you want to avail education loan for more than 6 months, there is a interest charged on monthly EMI's.|| No, there is no refund policy in this program.|",https://d9hhrg4mnvzow.cloudfront.net/course.digitalvidya.com/executive-program-digital-marketing/bfde8c05-saikat-d3adb9a31cacb2d8bd8d7b3a3fa48bea_1000000000000000000028.png | https://d9hhrg4mnvzow.cloudfront.net/course.digitalvidya.com/executive-program-digital-marketing/669a971e-shubham_1000000000000000000028.png | https://d9hhrg4mnvzow.cloudfront.net/course.digitalvidya.com/executive-program-digital-marketing/9365fc94-chandramohan_1000000000000000000028.png | https://d9hhrg4mnvzow.cloudfront.net/course.digitalvidya.com/executive-program-digital-marketing/e60b23d2-abhinay-patil_1000000000000000000028.png,"Zain is the founder of Startup Nebula, which is an idea lab aiming to support startups and also co-founder of Wicked Broz, which is India’s premier graffiti agency where he is chief storyteller.|Shawn Powrie is an experienced digital marketer and entrepreneur. His digital marketing career has spanned in-house, agency-side, and freelance, including the role of partner and operations manager in one of Australia’s fastest growing digital marketing agencies.|As a CTO and co-founder of GreyBox Technologies, Rajeev has produced successful results working closely with various B2B and B2C businesses to achieve their online goals, including measuring the true contribution of each online marketing channel.|Praful Kumar Jain currently works at the Google Operations Centre as a Digital Marketing lead, having previously worked with Cognizant technology solutions for AdWords and Analytics and Accenture in marketing lead roles.|Samvidha has served the Digital Marketing industry for over 8 years now. She has worked with big brands like Ebay, Amazon, Chevrolet, ToysRUs along with small businesses such as Handyman.com, WindowDecals.com and CarBras.|Shweta, a veteran marketer who served the corporate industry for 10+ years, realised the paradigm shift to marketing going online and is an alumni of Digital Vidya. She is the CEO and cofounder at Shail Digital having previously worked at Boston IT solutions.|He works as Specialist, Biddable Media at GroupM Media India Pvt. Ltd. to help clients achieve targets and strategy by leveraging his in-depth hands-on knowledge of paid tools like Google Ads, Facebook Ads, Bing Ads, & so on.|Hiren does stuff on the Internet. He has helped 500+ brands to create buzz online and to grow their business online. 7 years later, he still does the same thing every day with the same pace. Hiren worked for brand’s like Philips, Baskin Robbins, Sahara India Pariwar, Fasos, Quikkr, Starbucks to name a few.|Chandan has been working with businesses and entrepreneurs to develop and implement digital marketing strategies, enabling them to focus on what lights up their businesses.|A Marketer with training from the Leeds Business School, UK and an alumni of Digital Vidya – Priyash is a renowned Digital Marketer known for his skills in the B2B space. He is the CEO/ Cofounder of Zergon Biz Consultants, having previously worked as Vice President at Global X partners.",12 Months|18 Months|24 Months,₹ 9757|₹ 6807|₹ 5332,: Deakin University Digital Marketing Leadership program is designed for the following:|CXO's and Senior Leaders who want to expand their Digital Marketing learning and gain hands-on experience with the latest tools and techniques. They may want to manage Digital Marketing efforts in their organizations or learn how to improve customer experience.|Working Professionals seeking to move into a career in Digital Marketing and get their hands dirty with the latest trends and tools., It is expected that the learner has attended a graduation program and must meet Deakin’s English speaking requirement criteria.,"<p><strong>Module 1: </strong>Month 0.5 - Understand Digital Marketing Landscape & create your own Online Presence</p><p><strong>Module 2: </strong>Month 1 - Digital Marketing for Brands, Social Media Marketing & Email Marketing Techniques</p><p><strong>Module 3: </strong>Month 2 - Digital Brand Strategy & increasing Brand visibility with Google Ads & SEO Skills</p><p><strong>Module 4: </strong>Month 3 - Get to know Leadership Insights & leverage Google Analytics</p><p><strong>Module 5: </strong>Month 4 - Get industry ready with Affiliate techniques & award yourself with own Wall of Certificates</p>",,Instructor Paced,"data:image/gif;base64,R0lGODlhAQABAIAAAAAAAP///yH5BAEAAAAALAAAAAABAAEAAAIBRAA7"
